<?xml version="1.0" encoding="UTF-8" ?>
<tariffs xmlns:xsi="http://www.w3.org/2001/XMLSchema-instance"
         xmlns="http://www.example.com/tariffsTest"
         xsi:schemaLocation="http://www.example.com/tariffsTest tariffsTest.xsd">

    <start-tariff id="tariff-1.1.345.543" title="start">
        <operator-name>a1</operator-name>
        <payroll>9.0</payroll>
        <year>2021-10</year>
        <connection-fee>2.0</connection-fee>
        <calls>
            <call-prices-on-net>0.052</call-prices-on-net>
            <call-prices-on-another-network>0.104</call-prices-on-another-network>
            <call-prices-to-landline-phones>0.101</call-prices-to-landline-phones>
        </calls>
        <sms>sms</sms>
        <tariffication>sec60</tariffication>
        <favorite-number>3</favorite-number>
    </start-tariff>

    <start-tariff id="tariff-1.2.444.222" title="start">
        <operator-name>life</operator-name>
        <payroll>8.7</payroll>
        <year>2021-10</year>
        <connection-fee>1.0</connection-fee>
        <calls>
            <call-prices-on-net>0.045</call-prices-on-net>
            <call-prices-on-another-network>0.99</call-prices-on-another-network>
            <call-prices-to-landline-phones>0.94</call-prices-to-landline-phones>
        </calls>
        <sms>sms</sms>
        <tariffication>sec60</tariffication>
        <favorite-number>3</favorite-number>
    </start-tariff>

    <start-tariff id="tariff-1.3.143.314" title="start">
        <operator-name>mts</operator-name>
        <payroll>8.9</payroll>
        <year>2021-10</year>
        <connection-fee>1.5</connection-fee>
        <calls>
            <call-prices-on-net>0.050</call-prices-on-net>
            <call-prices-on-another-network>0.101</call-prices-on-another-network>
            <call-prices-to-landline-phones>0.95</call-prices-to-landline-phones>
        </calls>
        <sms>sms</sms>
        <tariffication>sec60</tariffication>
        <favorite-number>3</favorite-number>
    </start-tariff>

</tariffs>

